{"created_at":"2026-01-02T00:00:00Z","dataset_id":"ds.sp500.bars.v1","dataset_version":"2026-01-01.1","failure_reason":null,"frozen_specification_hash":"1111111111111111111111111111111111111111111111111111111111111111","idempotency_key":"idem.eval.001","job_id":"job.eval.001","job_schema_version":1,"output_manifest_hash":null,"state":"QUEUED","state_version":1,"strategy_id":"strat.trend.v1","strategy_version":"1.0.0","updated_at":"2026-01-02T00:00:00Z","worker_lease":null}
